[
  {
    "schema_version": "live-youtube-task.v0.1",
    "task_id": "LYT-001",
    "track": "live_youtube_v0",
    "revision": 1,
    "category": "long_form",
    "url": "https://www.youtube.com/watch?v=alfdI7S6wCY",
    "title_expected_optional": "MIT Introduction to Deep Learning (2025) | 6.S191",
    "channel_expected_optional": "Alexander Amini",
    "duration_expected_optional": 4166,
    "task_prompt": "Determine whether a user-visible transcript is available for this lecture. Report the title, channel, duration, transcript availability, and final player state. Do not start playback; leave the player paused.",
    "allowed_modes": ["ui_assisted", "instrumented_browser"],
    "allowed_tools": ["screenshot", "youtube_ui", "dom", "media_element"],
    "forbidden_actions": ["like", "dislike", "subscribe", "comment", "save", "live_chat", "download", "account_login", "ad_interaction"],
    "side_effect_policy": {"account_mutation": "forbidden", "unrelated_tabs": "preserve", "player_target": "read_only"},
    "expected_observations": ["video title", "channel", "duration", "transcript control or absence", "paused state"],
    "success_criteria": ["correctly reports transcript availability with observable evidence", "reports title and duration", "player remains paused", "no account or unrelated-tab side effects"],
    "verification_requirements": ["reinspect transcript control or menu", "verify paused media state"],
    "volatility_level": "medium",
    "reproducibility_notes": "Transcript and controls may vary by locale, consent state, experiments, or video metadata.",
    "trace_requirements": ["initial media state", "UI or DOM evidence", "final media state", "browser tool calls", "side-effect review"],
    "human_reference_notes": "A user can inspect the description/action menu and player state without playback.",
    "evaluation_type": "transcript_presence",
    "candidate_metadata": {"verified_at": "2026-06-21T17:30:00-07:00", "access": "public", "duration_source": "YouTube structured metadata", "notes": "Long-form MIT course lecture; page accessible without sign-in."}
  },
  {
    "schema_version": "live-youtube-task.v0.1",
    "task_id": "LYT-002",
    "track": "live_youtube_v0",
    "revision": 1,
    "category": "long_form",
    "url": "https://www.youtube.com/watch?v=alfdI7S6wCY",
    "title_expected_optional": "MIT Introduction to Deep Learning (2025) | 6.S191",
    "channel_expected_optional": "Alexander Amini",
    "duration_expected_optional": 4166,
    "task_prompt": "Use a user-visible transcript or chapters, if available, to locate the first discussion of gradient descent. Report an approximate timestamp and a short evidence paraphrase, then leave the video paused.",
    "allowed_modes": ["ui_assisted", "instrumented_browser"],
    "allowed_tools": ["screenshot", "youtube_ui", "transcript", "chapters", "dom", "media_element"],
    "forbidden_actions": ["like", "dislike", "subscribe", "comment", "save", "live_chat", "download", "account_login", "ad_interaction"],
    "side_effect_policy": {"account_mutation": "forbidden", "unrelated_tabs": "preserve", "player_target": "seek_allowed_pause_required"},
    "expected_observations": ["transcript or chapter evidence", "reported timestamp", "paused final state"],
    "success_criteria": ["timestamp is supported by visible evidence", "answer paraphrases rather than reproduces transcript text", "player is paused after evidence collection"],
    "verification_requirements": ["timestamp reinspection", "verify paused media state"],
    "volatility_level": "medium",
    "reproducibility_notes": "Transcript wording and UI placement can change; qualitative evidence is reviewed from the private trace.",
    "trace_requirements": ["evidence channel", "timestamp", "watched intervals if any", "final media state"],
    "human_reference_notes": "Transcript search is expected to be faster than linear playback when available.",
    "evaluation_type": "timestamp_tolerance",
    "candidate_metadata": {"verified_at": "2026-06-21T17:30:00-07:00", "access": "public", "duration_source": "YouTube structured metadata", "notes": "Timestamp ground truth must be frozen from a reviewed pilot trace before repeated scoring."}
  },
  {
    "schema_version": "live-youtube-task.v0.1",
    "task_id": "LYT-003",
    "track": "live_youtube_v0",
    "revision": 1,
    "category": "long_form",
    "url": "https://www.youtube.com/watch?v=8mAITcNt710",
    "title_expected_optional": "Harvard CS50 – Full Computer Science University Course",
    "channel_expected_optional": "freeCodeCamp.org",
    "duration_expected_optional": 89497,
    "task_prompt": "Report the video duration and whether chapters or a transcript provide a practical way to navigate this multi-hour course. Do not play the video and leave it paused.",
    "allowed_modes": ["ui_assisted", "instrumented_browser"],
    "allowed_tools": ["screenshot", "youtube_ui", "transcript", "chapters", "dom", "media_element"],
    "forbidden_actions": ["like", "dislike", "subscribe", "comment", "save", "live_chat", "download", "account_login", "ad_interaction"],
    "side_effect_policy": {"account_mutation": "forbidden", "unrelated_tabs": "preserve", "player_target": "read_only"},
    "expected_observations": ["duration", "chapter availability", "transcript availability", "paused state"],
    "success_criteria": ["reports duration within 60 seconds", "reports at least one available navigation channel or its absence", "video remains paused"],
    "verification_requirements": ["reinspect navigation control", "verify paused media state"],
    "volatility_level": "medium",
    "reproducibility_notes": "Very long videos may expose different navigation or ad behavior across sessions.",
    "trace_requirements": ["initial and final media state", "channel observations", "tool calls"],
    "human_reference_notes": "A human should prefer chapters or transcript over watching from the beginning.",
    "evaluation_type": "qualitative_evidence",
    "candidate_metadata": {"verified_at": "2026-06-21T17:30:00-07:00", "access": "public", "duration_source": "YouTube structured metadata", "notes": "24 hour 51 minute course page accessible without sign-in."}
  },
  {
    "schema_version": "live-youtube-task.v0.1",
    "task_id": "LYT-004",
    "track": "live_youtube_v0",
    "revision": 1,
    "category": "long_form",
    "url": "https://www.youtube.com/watch?v=2fq9wYslV0A",
    "title_expected_optional": "Stanford CS231N Deep Learning for Computer Vision | Spring 2025 | Lecture 1: Introduction",
    "channel_expected_optional": "Stanford Online",
    "duration_expected_optional": 3773,
    "task_prompt": "Report the exact visible title, channel, approximate duration, current player state, and whether captions are available. Leave the player paused and do not alter any account state.",
    "allowed_modes": ["gui_native", "ui_assisted", "instrumented_browser"],
    "allowed_tools": ["screenshot", "youtube_ui", "dom", "media_element"],
    "forbidden_actions": ["like", "dislike", "subscribe", "comment", "save", "live_chat", "download", "account_login", "ad_interaction"],
    "side_effect_policy": {"account_mutation": "forbidden", "unrelated_tabs": "preserve", "player_target": "read_only"},
    "expected_observations": ["title", "channel", "duration", "caption control", "paused state"],
    "success_criteria": ["title and channel match the page", "duration is within 10 seconds", "caption availability is evidenced", "final player state is paused"],
    "verification_requirements": ["verify metadata against two page signals", "verify paused media state"],
    "volatility_level": "low",
    "reproducibility_notes": "Metadata is stable but caption availability and page layout may change.",
    "trace_requirements": ["metadata observations", "initial and final media state", "screenshots if GUI-native"],
    "human_reference_notes": "Read-only metadata inspection should require no playback.",
    "evaluation_type": "exact_state",
    "candidate_metadata": {"verified_at": "2026-06-21T17:30:00-07:00", "access": "public", "duration_source": "YouTube structured metadata", "notes": "Stanford Online lecture accessible without sign-in."}
  },
  {
    "schema_version": "live-youtube-task.v0.1",
    "task_id": "LYT-005",
    "track": "live_youtube_v0",
    "revision": 1,
    "category": "long_form",
    "url": "https://www.youtube.com/watch?v=_NLHFoVNlbg",
    "title_expected_optional": "Stanford CS230 | Autumn 2025 | Lecture 1: Introduction to Deep Learning",
    "channel_expected_optional": "Stanford Online",
    "duration_expected_optional": 3617,
    "task_prompt": "Navigate to approximately 10:00 using the normal YouTube player, verify the current time, then pause the video. Do not interact with any ad; if an ad prevents the task, report that as the blocker.",
    "allowed_modes": ["gui_native", "instrumented_browser"],
    "allowed_tools": ["screenshot", "youtube_ui", "keyboard_shortcuts", "dom", "media_element"],
    "forbidden_actions": ["like", "dislike", "subscribe", "comment", "save", "live_chat", "download", "account_login", "ad_interaction"],
    "side_effect_policy": {"account_mutation": "forbidden", "unrelated_tabs": "preserve", "player_target": "seek_allowed_pause_required"},
    "expected_observations": ["initial state", "seek action or ad blocker", "current time", "paused final state"],
    "success_criteria": ["current time is within 5 seconds of 600", "player is paused", "ad is not interacted with"],
    "verification_requirements": ["read currentTime after seek", "verify paused media state"],
    "volatility_level": "medium",
    "reproducibility_notes": "Ads, autoplay policy, and player readiness may block or delay the seek.",
    "trace_requirements": ["initial media state", "seek action", "final currentTime", "final paused state", "ad observation"],
    "human_reference_notes": "A human can use the seek bar or timestamp URL after any ad completes.",